=======================================
Part 1: Regression Tests (Seeds 1-1000)
=======================================

Building Rust binaries...
Running unified tests...
Comparing unified results...


Unified tests: 1000/1000 passed
No regressions detected.

=======================================
Part 2: Minimized Seeds Tests (minimized teams)
=======================================

Running 156 minimized seed tests...
Comparing minimized results...

FAIL Seed 15759 (minimized):
  JS:   SEED 15759: turns=49, prng=121, winner=p1
  Rust: SEED 15759: turns=48, prng=118, winner=p1
FAIL Seed 15974 (minimized):
  JS:   SEED 15974: turns=20, prng=197, winner=p1
  Rust: SEED 15974: turns=20, prng=169, winner=p1
FAIL Seed 20356 (minimized):
  JS:   SEED 20356: turns=38, prng=159, winner=p1
  Rust: SEED 20356: turns=39, prng=164, winner=p1
FAIL Seed 25574 (minimized):
  JS:   SEED 25574: turns=11, prng=33, winner=p2
  Rust: SEED 25574: turns=11, prng=43, winner=p2
FAIL Seed 30232 (minimized):
  JS:   SEED 30232: turns=31, prng=152, winner=p2
  Rust: SEED 30232: turns=32, prng=155, winner=p2
FAIL Seed 32939 (minimized):
  JS:   SEED 32939: turns=13, prng=65, winner=p1
  Rust: SEED 32939: turns=13, prng=64, winner=p1
FAIL Seed 35620 (minimized):
  JS:   SEED 35620: turns=9, prng=27, winner=p2
  Rust: SEED 35620: turns=9, prng=35, winner=p2
FAIL Seed 37514 (minimized):
  JS:   SEED 37514: turns=35, prng=168, winner=p1
  Rust: SEED 37514: turns=36, prng=172, winner=p1
FAIL Seed 39361 (minimized):
  JS:   SEED 39361: turns=11, prng=56, winner=p1
  Rust: SEED 39361: turns=25, prng=98, winner=p2
FAIL Seed 39892 (minimized):
  JS:   SEED 39892: turns=6, prng=24, winner=p1
  Rust: SEED 39892: turns=17, prng=42, winner=p2
FAIL Seed 40910 (minimized):
  JS:   SEED 40910: turns=2, prng=16, winner=p1
  Rust: SEED 40910: turns=3, prng=24, winner=p1
FAIL Seed 42548 (minimized):
  JS:   SEED 42548: turns=80, prng=315, winner=p2
  Rust: SEED 42548: turns=80, prng=322, winner=p2
FAIL Seed 45311 (minimized):
  JS:   SEED 45311: turns=3, prng=18, winner=p2
  Rust: SEED 45311: turns=2, prng=12, winner=p2
FAIL Seed 48318 (minimized):
  JS:   SEED 48318: turns=2, prng=7, winner=p2
  Rust: SEED 48318: turns=10, prng=30, winner=p1
FAIL Seed 48869 (minimized):
  JS:   SEED 48869: turns=3, prng=15, winner=p2
  Rust: SEED 48869: turns=4, prng=25, winner=p2
FAIL Seed 53747 (minimized):
  JS:   SEED 53747: turns=27, prng=133, winner=p1
  Rust: SEED 53747: turns=28, prng=139, winner=p1
FAIL Seed 54588 (minimized):
  JS:   SEED 54588: turns=74, prng=276, winner=p2
  Rust: SEED 54588: turns=68, prng=249, winner=p2
FAIL Seed 56089 (minimized):
  JS:   SEED 56089: turns=17, prng=53, winner=p1
  Rust: SEED 56089: turns=18, prng=55, winner=p1
FAIL Seed 56825 (minimized):
  JS:   SEED 56825: turns=40, prng=48, winner=p2
  Rust: SEED 56825: turns=41, prng=51, winner=p2
FAIL Seed 60349 (minimized):
  JS:   SEED 60349: turns=9, prng=51, winner=p2
  Rust: SEED 60349: turns=9, prng=60, winner=p2
FAIL Seed 60818 (minimized):
  JS:   SEED 60818: turns=70, prng=295, winner=p2
  Rust: SEED 60818: turns=58, prng=247, winner=p2
FAIL Seed 60885 (minimized):
  JS:   SEED 60885: turns=32, prng=106, winner=p1
  Rust: SEED 60885: turns=32, prng=109, winner=p1
FAIL Seed 61343 (minimized):
  JS:   SEED 61343: turns=8, prng=270, winner=p1
  Rust: SEED 61343: turns=8, prng=170, winner=p1
FAIL Seed 64286 (minimized):
  JS:   SEED 64286: turns=73, prng=200, winner=p2
  Rust: SEED 64286: turns=81, prng=218, winner=p2
FAIL Seed 64566 (minimized):
  JS:   SEED 64566: turns=6, prng=189, winner=p1
  Rust: SEED 64566: turns=6, prng=126, winner=p1
FAIL Seed 65490 (minimized):
  JS:   SEED 65490: turns=33, prng=125, winner=p2
  Rust: SEED 65490: turns=31, prng=114, winner=p2
FAIL Seed 65503 (minimized):
  JS:   SEED 65503: turns=18, prng=47, winner=p1
  Rust: SEED 65503: turns=19, prng=52, winner=p1
FAIL Seed 67961 (minimized):
  JS:   SEED 67961: turns=67, prng=238, winner=p1
  Rust: SEED 67961: turns=65, prng=232, winner=p2
FAIL Seed 70293 (minimized):
  JS:   SEED 70293: turns=11, prng=66, winner=p2
  Rust: SEED 70293: turns=8, prng=54, winner=p2
FAIL Seed 71148 (minimized):
  JS:   SEED 71148: turns=86, prng=313, winner=p1
  Rust: SEED 71148: turns=82, prng=308, winner=p1
FAIL Seed 71155 (minimized):
  JS:   SEED 71155: turns=4, prng=37, winner=p2
  Rust: SEED 71155: turns=4, prng=39, winner=p2
FAIL Seed 71505 (minimized):
  JS:   SEED 71505: turns=38, prng=179, winner=p1
  Rust: SEED 71505: turns=38, prng=178, winner=p1
FAIL Seed 71847 (minimized):
  JS:   SEED 71847: turns=25, prng=219, winner=p2
  Rust: SEED 71847: turns=25, prng=200, winner=p2
FAIL Seed 72782 (minimized):
  JS:   SEED 72782: turns=21, prng=58, winner=p1
  Rust: SEED 72782: turns=18, prng=64, winner=p1
FAIL Seed 73093 (minimized):
  JS:   SEED 73093: turns=92, prng=223, winner=none
  Rust: SEED 73093: turns=66, prng=200, winner=p2
FAIL Seed 73448 (minimized):
  JS:   SEED 73448: turns=33, prng=162, winner=p1
  Rust: SEED 73448: turns=30, prng=149, winner=p1
FAIL Seed 73880 (minimized):
  JS:   SEED 73880: turns=6, prng=24, winner=p2
  Rust: SEED 73880: turns=9, prng=20, winner=p1
FAIL Seed 74439 (minimized):
  JS:   SEED 74439: turns=10, prng=57, winner=p2
  Rust: SEED 74439: turns=10, prng=60, winner=p2
FAIL Seed 77834 (minimized):
  JS:   SEED 77834: turns=68, prng=187, winner=p2
  Rust: SEED 77834: turns=70, prng=209, winner=p2
FAIL Seed 78126 (minimized):
  JS:   SEED 78126: turns=48, prng=202, winner=p2
  Rust: SEED 78126: turns=50, prng=211, winner=p1
FAIL Seed 78875 (minimized):
  JS:   SEED 78875: turns=31, prng=93, winner=p1
  Rust: SEED 78875: turns=32, prng=111, winner=p1
FAIL Seed 79574 (minimized):
  JS:   SEED 79574: turns=26, prng=93, winner=p1
  Rust: SEED 79574: turns=23, prng=87, winner=p1
FAIL Seed 80374 (minimized):
  JS:   SEED 80374: turns=20, prng=52, winner=p2
  Rust: SEED 80374: turns=18, prng=55, winner=p2
FAIL Seed 81764 (minimized):
  JS:   SEED 81764: turns=20, prng=74, winner=p2
  Rust: SEED 81764: turns=22, prng=80, winner=p2
FAIL Seed 82263 (minimized):
  JS:   SEED 82263: turns=30, prng=143, winner=p2
  Rust: SEED 82263: turns=14, prng=73, winner=p2
FAIL Seed 82556 (minimized):
  JS:   SEED 82556: turns=4, prng=14, winner=p2
  Rust: SEED 82556: turns=6, prng=21, winner=p2
FAIL Seed 82834 (minimized):
  JS:   SEED 82834: turns=29, prng=56, winner=p1
  Rust: SEED 82834: turns=30, prng=59, winner=p1
FAIL Seed 85281 (minimized):
  JS:   SEED 85281: turns=71, prng=158, winner=p2
  Rust: SEED 85281: turns=69, prng=156, winner=p1
FAIL Seed 87270 (minimized):
  JS:   SEED 87270: turns=45, prng=193, winner=p1
  Rust: SEED 87270: turns=37, prng=152, winner=p2
FAIL Seed 87363 (minimized):
  JS:   SEED 87363: turns=7, prng=28, winner=p1
  Rust: SEED 87363: turns=8, prng=32, winner=p1
FAIL Seed 88904 (minimized):
  JS:   SEED 88904: turns=15, prng=61, winner=p2
  Rust: SEED 88904: turns=9, prng=22, winner=p1
FAIL Seed 89804 (minimized):
  JS:   SEED 89804: turns=86, prng=216, winner=p2
  Rust: SEED 89804: turns=87, prng=219, winner=p2
FAIL Seed 90577 (minimized):
  JS:   SEED 90577: turns=11, prng=33, winner=p2
  Rust: SEED 90577: turns=10, prng=70, winner=p2
FAIL Seed 92938 (minimized):
  JS:   SEED 92938: turns=4, prng=21, winner=p1
  Rust: SEED 92938: turns=4, prng=24, winner=p1
FAIL Seed 95041 (minimized):
  JS:   SEED 95041: turns=25, prng=119, winner=p1
  Rust: SEED 95041: turns=24, prng=114, winner=p1
FAIL Seed 95061 (minimized):
  JS:   SEED 95061: turns=36, prng=18, winner=p2
  Rust: SEED 95061: turns=36, prng=20, winner=p2
FAIL Seed 95236 (minimized):
  JS:   SEED 95236: turns=16, prng=74, winner=p2
  Rust: SEED 95236: turns=17, prng=80, winner=p2
FAIL Seed 96183 (minimized):
  JS:   SEED 96183: turns=24, prng=128, winner=p2
  Rust: SEED 96183: turns=23, prng=122, winner=p2
FAIL Seed 96673 (minimized):
  JS:   SEED 96673: turns=47, prng=85, winner=p2
  Rust: SEED 96673: turns=46, prng=82, winner=p2
FAIL Seed 97470 (minimized):
  JS:   SEED 97470: turns=10, prng=64, winner=p2
  Rust: SEED 97470: turns=11, prng=68, winner=p2
FAIL Seed 97549 (minimized):
  JS:   SEED 97549: turns=34, prng=135, winner=p1
  Rust: SEED 97549: turns=50, prng=182, winner=p1
FAIL Seed 99388 (minimized):
  JS:   SEED 99388: turns=59, prng=201, winner=p1
  Rust: SEED 99388: turns=70, prng=240, winner=p1

=======================================
Part 3: Full Team Tests (same seeds, generated teams)
=======================================

Running 156 seeds with full generated teams...
Comparing full team results...

FAIL Seed 15759 (full team):
  JS:   SEED 15759: turns=71, prng=217, winner=p2
  Rust: SEED 15759: turns=63, prng=182, winner=p2
FAIL Seed 15974 (full team):
  JS:   SEED 15974: turns=83, prng=260, winner=p2
  Rust: SEED 15974: turns=84, prng=252, winner=p2
FAIL Seed 20356 (full team):
  JS:   SEED 20356: turns=52, prng=186, winner=p1
  Rust: SEED 20356: turns=53, prng=191, winner=p1
FAIL Seed 25574 (full team):
  JS:   SEED 25574: turns=59, prng=230, winner=p2
  Rust: SEED 25574: turns=57, prng=233, winner=p2
FAIL Seed 30232 (full team):
  JS:   SEED 30232: turns=52, prng=282, winner=p1
  Rust: SEED 30232: turns=64, prng=348, winner=p1
FAIL Seed 32939 (full team):
  JS:   SEED 32939: turns=37, prng=161, winner=p1
  Rust: SEED 32939: turns=39, prng=174, winner=p1
FAIL Seed 35620 (full team):
  JS:   SEED 35620: turns=70, prng=314, winner=p1
  Rust: SEED 35620: turns=72, prng=329, winner=p1
FAIL Seed 37514 (full team):
  JS:   SEED 37514: turns=94, prng=351, winner=none
  Rust: SEED 37514: turns=91, prng=337, winner=p1
FAIL Seed 39361 (full team):
  JS:   SEED 39361: turns=44, prng=241, winner=p1
  Rust: SEED 39361: turns=55, prng=275, winner=p1
FAIL Seed 39892 (full team):
  JS:   SEED 39892: turns=9, prng=30, winner=p1
  Rust: SEED 39892: turns=46, prng=134, winner=p1
FAIL Seed 40192 (full team):
  JS:   SEED 40192: turns=85, prng=490, winner=p2
  Rust: SEED 40192: turns=85, prng=522, winner=p2
FAIL Seed 40910 (full team):
  JS:   SEED 40910: turns=39, prng=201, winner=p1
  Rust: SEED 40910: turns=51, prng=263, winner=p2
FAIL Seed 42548 (full team):
  JS:   SEED 42548: turns=80, prng=315, winner=p2
  Rust: SEED 42548: turns=80, prng=322, winner=p2
FAIL Seed 45311 (full team):
  JS:   SEED 45311: turns=17, prng=81, winner=p2
  Rust: SEED 45311: turns=14, prng=71, winner=p2
FAIL Seed 48318 (full team):
  JS:   SEED 48318: turns=45, prng=185, winner=p2
  Rust: SEED 48318: turns=47, prng=201, winner=p2
FAIL Seed 48869 (full team):
  JS:   SEED 48869: turns=41, prng=85, winner=p2
  Rust: SEED 48869: turns=41, prng=93, winner=p2
FAIL Seed 53747 (full team):
  JS:   SEED 53747: turns=60, prng=214, winner=p2
  Rust: SEED 53747: turns=58, prng=198, winner=p2
FAIL Seed 54588 (full team):
  JS:   SEED 54588: turns=74, prng=276, winner=p2
  Rust: SEED 54588: turns=68, prng=249, winner=p2
FAIL Seed 56089 (full team):
  JS:   SEED 56089: turns=48, prng=206, winner=p1
  Rust: SEED 56089: turns=49, prng=212, winner=p1
FAIL Seed 56825 (full team):
  JS:   SEED 56825: turns=52, prng=144, winner=p2
  Rust: SEED 56825: turns=65, prng=197, winner=p2
FAIL Seed 60349 (full team):
  JS:   SEED 60349: turns=63, prng=215, winner=p1
  Rust: SEED 60349: turns=64, prng=223, winner=p1
FAIL Seed 60818 (full team):
  JS:   SEED 60818: turns=74, prng=293, winner=p1
  Rust: SEED 60818: turns=70, prng=277, winner=p1
FAIL Seed 60885 (full team):
  JS:   SEED 60885: turns=60, prng=243, winner=p1
  Rust: SEED 60885: turns=60, prng=246, winner=p1
FAIL Seed 61343 (full team):
  JS:   SEED 61343: turns=49, prng=431, winner=p1
  Rust: SEED 61343: turns=49, prng=342, winner=p1
FAIL Seed 64286 (full team):
  JS:   SEED 64286: turns=73, prng=200, winner=p2
  Rust: SEED 64286: turns=81, prng=218, winner=p2
FAIL Seed 64566 (full team):
  JS:   SEED 64566: turns=93, prng=418, winner=none
  Rust: SEED 64566: turns=93, prng=346, winner=none
FAIL Seed 65490 (full team):
  JS:   SEED 65490: turns=42, prng=167, winner=p2
  Rust: SEED 65490: turns=43, prng=172, winner=p2
FAIL Seed 65503 (full team):
  JS:   SEED 65503: turns=44, prng=178, winner=p2
  Rust: SEED 65503: turns=45, prng=185, winner=p2
FAIL Seed 67961 (full team):
  JS:   SEED 67961: turns=67, prng=238, winner=p1
  Rust: SEED 67961: turns=65, prng=232, winner=p2
FAIL Seed 70293 (full team):
  JS:   SEED 70293: turns=59, prng=312, winner=p2
  Rust: SEED 70293: turns=51, prng=260, winner=p2
FAIL Seed 71148 (full team):
  JS:   SEED 71148: turns=86, prng=313, winner=p1
  Rust: SEED 71148: turns=82, prng=308, winner=p1
FAIL Seed 71155 (full team):
  JS:   SEED 71155: turns=73, prng=280, winner=p1
  Rust: SEED 71155: turns=76, prng=297, winner=p1
FAIL Seed 71505 (full team):
  JS:   SEED 71505: turns=48, prng=208, winner=p1
  Rust: SEED 71505: turns=49, prng=208, winner=p1
FAIL Seed 71847 (full team):
  JS:   SEED 71847: turns=38, prng=172, winner=p2
  Rust: SEED 71847: turns=40, prng=170, winner=p2
FAIL Seed 72782 (full team):
  JS:   SEED 72782: turns=57, prng=150, winner=p1
  Rust: SEED 72782: turns=62, prng=196, winner=p1
FAIL Seed 73093 (full team):
  JS:   SEED 73093: turns=92, prng=223, winner=none
  Rust: SEED 73093: turns=66, prng=200, winner=p2
FAIL Seed 73448 (full team):
  JS:   SEED 73448: turns=33, prng=162, winner=p1
  Rust: SEED 73448: turns=30, prng=149, winner=p1
FAIL Seed 73880 (full team):
  JS:   SEED 73880: turns=48, prng=231, winner=p2
  Rust: SEED 73880: turns=47, prng=174, winner=p2
FAIL Seed 74439 (full team):
  JS:   SEED 74439: turns=25, prng=100, winner=p2
  Rust: SEED 74439: turns=23, prng=99, winner=p2
FAIL Seed 77834 (full team):
  JS:   SEED 77834: turns=68, prng=187, winner=p2
  Rust: SEED 77834: turns=70, prng=209, winner=p2
FAIL Seed 78126 (full team):
  JS:   SEED 78126: turns=48, prng=202, winner=p2
  Rust: SEED 78126: turns=50, prng=211, winner=p1
FAIL Seed 78875 (full team):
  JS:   SEED 78875: turns=67, prng=271, winner=p1
  Rust: SEED 78875: turns=70, prng=298, winner=p1
FAIL Seed 79574 (full team):
  JS:   SEED 79574: turns=26, prng=93, winner=p1
  Rust: SEED 79574: turns=23, prng=87, winner=p1
FAIL Seed 80374 (full team):
  JS:   SEED 80374: turns=93, prng=285, winner=none
  Rust: SEED 80374: turns=93, prng=281, winner=none
FAIL Seed 81764 (full team):
  JS:   SEED 81764: turns=47, prng=245, winner=p2
  Rust: SEED 81764: turns=53, prng=263, winner=p2
FAIL Seed 82263 (full team):
  JS:   SEED 82263: turns=83, prng=241, winner=p2
  Rust: SEED 82263: turns=78, prng=202, winner=p2
FAIL Seed 82556 (full team):
  JS:   SEED 82556: turns=13, prng=63, winner=p1
  Rust: SEED 82556: turns=16, prng=77, winner=p1
FAIL Seed 82834 (full team):
  JS:   SEED 82834: turns=58, prng=254, winner=p2
  Rust: SEED 82834: turns=56, prng=256, winner=p2
FAIL Seed 85281 (full team):
  JS:   SEED 85281: turns=78, prng=180, winner=p1
  Rust: SEED 85281: turns=74, prng=170, winner=p1
FAIL Seed 87270 (full team):
  JS:   SEED 87270: turns=45, prng=193, winner=p1
  Rust: SEED 87270: turns=37, prng=152, winner=p2
FAIL Seed 87363 (full team):
  JS:   SEED 87363: turns=27, prng=104, winner=p1
  Rust: SEED 87363: turns=28, prng=108, winner=p1
FAIL Seed 88904 (full team):
  JS:   SEED 88904: turns=84, prng=414, winner=p1
  Rust: SEED 88904: turns=89, prng=418, winner=p1
FAIL Seed 89804 (full team):
  JS:   SEED 89804: turns=62, prng=210, winner=p1
  Rust: SEED 89804: turns=63, prng=219, winner=p1
FAIL Seed 90577 (full team):
  JS:   SEED 90577: turns=41, prng=182, winner=p2
  Rust: SEED 90577: turns=36, prng=277, winner=p2
FAIL Seed 92938 (full team):
  JS:   SEED 92938: turns=18, prng=69, winner=p1
  Rust: SEED 92938: turns=42, prng=145, winner=p1
FAIL Seed 95041 (full team):
  JS:   SEED 95041: turns=25, prng=119, winner=p1
  Rust: SEED 95041: turns=24, prng=114, winner=p1
FAIL Seed 95061 (full team):
  JS:   SEED 95061: turns=62, prng=123, winner=p2
  Rust: SEED 95061: turns=59, prng=105, winner=p2
FAIL Seed 95236 (full team):
  JS:   SEED 95236: turns=50, prng=295, winner=p2
  Rust: SEED 95236: turns=37, prng=209, winner=p1
FAIL Seed 96183 (full team):
  JS:   SEED 96183: turns=74, prng=273, winner=p2
  Rust: SEED 96183: turns=74, prng=269, winner=p2
FAIL Seed 96673 (full team):
  JS:   SEED 96673: turns=69, prng=198, winner=p2
  Rust: SEED 96673: turns=69, prng=204, winner=p2
FAIL Seed 97470 (full team):
  JS:   SEED 97470: turns=85, prng=262, winner=p2
  Rust: SEED 97470: turns=55, prng=198, winner=p2
FAIL Seed 97549 (full team):
  JS:   SEED 97549: turns=34, prng=135, winner=p1
  Rust: SEED 97549: turns=50, prng=182, winner=p1
FAIL Seed 99388 (full team):
  JS:   SEED 99388: turns=59, prng=201, winner=p1
  Rust: SEED 99388: turns=70, prng=240, winner=p1

=======================================
Final Summary
=======================================

Regression tests (1-1000): 1000/1000 passed
Minimized teams: 94/156 passed
Full teams: 93/156 passed

Failed full team seeds: 15759 15974 20356 25574 30232 32939 35620 37514 39361 39892 40192 40910 42548 45311 48318 48869 53747 54588 56089 56825 60349 60818 60885 61343 64286 64566 65490 65503 67961 70293 71148 71155 71505 71847 72782 73093 73448 73880 74439 77834 78126 78875 79574 80374 81764 82263 82556 82834 85281 87270 87363 88904 89804 90577 92938 95041 95061 95236 96183 96673 97470 97549 99388
Minimized seeds pass rate: 60%
Failed minimized seeds: 15759 15974 20356 25574 30232 32939 35620 37514 39361 39892 40910 42548 45311 48318 48869 53747 54588 56089 56825 60349 60818 60885 61343 64286 64566 65490 65503 67961 70293 71148 71155 71505 71847 72782 73093 73448 73880 74439 77834 78126 78875 79574 80374 81764 82263 82556 82834 85281 87270 87363 88904 89804 90577 92938 95041 95061 95236 96183 96673 97470 97549 99388

Updating bug-analysis.txt...
Done. See tests/bug-analysis.txt for patterns in failing seeds.

SUCCESS: No regressions detected.
