=======================================
Part 1: Regression Tests (Seeds 1-1000)
=======================================

Building Rust binaries...
Running unified tests...
Comparing unified results...


Unified tests: 1000/1000 passed
No regressions detected.

=======================================
Part 2: Minimized Seeds Tests (minimized teams)
=======================================

Running 156 minimized seed tests...
Comparing minimized results...

FAIL Seed 15759 (minimized):
  JS:   SEED 15759: turns=49, prng=121, winner=p1
  Rust: SEED 15759: turns=48, prng=118, winner=p1
FAIL Seed 15974 (minimized):
  JS:   SEED 15974: turns=20, prng=197, winner=p1
  Rust: SEED 15974: turns=20, prng=169, winner=p1
FAIL Seed 39361 (minimized):
  JS:   SEED 39361: turns=11, prng=56, winner=p1
  Rust: SEED 39361: turns=25, prng=98, winner=p2
FAIL Seed 40910 (minimized):
  JS:   SEED 40910: turns=2, prng=16, winner=p1
  Rust: SEED 40910: turns=3, prng=24, winner=p1
FAIL Seed 45311 (minimized):
  JS:   SEED 45311: turns=3, prng=18, winner=p2
  Rust: SEED 45311: turns=2, prng=12, winner=p2
FAIL Seed 48318 (minimized):
  JS:   SEED 48318: turns=2, prng=7, winner=p2
  Rust: SEED 48318: turns=10, prng=30, winner=p1
FAIL Seed 60349 (minimized):
  JS:   SEED 60349: turns=9, prng=51, winner=p2
  Rust: SEED 60349: turns=9, prng=60, winner=p2
FAIL Seed 60818 (minimized):
  JS:   SEED 60818: turns=70, prng=295, winner=p2
  Rust: SEED 60818: turns=58, prng=247, winner=p2
FAIL Seed 64286 (minimized):
  JS:   SEED 64286: turns=73, prng=200, winner=p2
  Rust: SEED 64286: turns=81, prng=218, winner=p2
FAIL Seed 67961 (minimized):
  JS:   SEED 67961: turns=67, prng=238, winner=p1
  Rust: SEED 67961: turns=65, prng=232, winner=p2
FAIL Seed 71155 (minimized):
  JS:   SEED 71155: turns=4, prng=37, winner=p2
  Rust: SEED 71155: turns=4, prng=39, winner=p2
FAIL Seed 71505 (minimized):
  JS:   SEED 71505: turns=38, prng=179, winner=p1
  Rust: SEED 71505: turns=38, prng=178, winner=p1
FAIL Seed 72782 (minimized):
  JS:   SEED 72782: turns=21, prng=58, winner=p1
  Rust: SEED 72782: turns=18, prng=64, winner=p1
FAIL Seed 74439 (minimized):
  JS:   SEED 74439: turns=10, prng=57, winner=p2
  Rust: SEED 74439: turns=10, prng=60, winner=p2
FAIL Seed 78126 (minimized):
  JS:   SEED 78126: turns=48, prng=202, winner=p2
  Rust: SEED 78126: turns=50, prng=211, winner=p1
FAIL Seed 79574 (minimized):
  JS:   SEED 79574: turns=26, prng=93, winner=p1
  Rust: SEED 79574: turns=23, prng=87, winner=p1
FAIL Seed 80374 (minimized):
  JS:   SEED 80374: turns=20, prng=52, winner=p2
  Rust: SEED 80374: turns=18, prng=55, winner=p2
FAIL Seed 85281 (minimized):
  JS:   SEED 85281: turns=71, prng=158, winner=p2
  Rust: SEED 85281: turns=69, prng=156, winner=p1
FAIL Seed 87270 (minimized):
  JS:   SEED 87270: turns=45, prng=193, winner=p1
  Rust: SEED 87270: turns=37, prng=152, winner=p2
FAIL Seed 87363 (minimized):
  JS:   SEED 87363: turns=7, prng=28, winner=p1
  Rust: SEED 87363: turns=8, prng=32, winner=p1
FAIL Seed 90577 (minimized):
  JS:   SEED 90577: turns=11, prng=33, winner=p2
  Rust: SEED 90577: turns=10, prng=70, winner=p2
FAIL Seed 92938 (minimized):
  JS:   SEED 92938: turns=4, prng=21, winner=p1
  Rust: SEED 92938: turns=4, prng=24, winner=p1
FAIL Seed 95061 (minimized):
  JS:   SEED 95061: turns=36, prng=18, winner=p2
  Rust: SEED 95061: turns=36, prng=20, winner=p2
FAIL Seed 96673 (minimized):
  JS:   SEED 96673: turns=47, prng=85, winner=p2
  Rust: SEED 96673: turns=46, prng=82, winner=p2
FAIL Seed 97470 (minimized):
  JS:   SEED 97470: turns=10, prng=64, winner=p2
  Rust: SEED 97470: turns=11, prng=68, winner=p2
FAIL Seed 99388 (minimized):
  JS:   SEED 99388: turns=59, prng=201, winner=p1
  Rust: SEED 99388: turns=70, prng=240, winner=p1

=======================================
Part 3: Full Team Tests (same seeds, generated teams)
=======================================

Running 156 seeds with full generated teams...
Comparing full team results...

FAIL Seed 15759 (full team):
  JS:   SEED 15759: turns=71, prng=217, winner=p2
  Rust: SEED 15759: turns=63, prng=182, winner=p2
FAIL Seed 15974 (full team):
  JS:   SEED 15974: turns=83, prng=260, winner=p2
  Rust: SEED 15974: turns=84, prng=252, winner=p2
FAIL Seed 30232 (full team):
  JS:   SEED 30232: turns=52, prng=282, winner=p1
  Rust: SEED 30232: turns=45, prng=256, winner=p2
FAIL Seed 39361 (full team):
  JS:   SEED 39361: turns=44, prng=241, winner=p1
  Rust: SEED 39361: turns=55, prng=275, winner=p1
FAIL Seed 40192 (full team):
  JS:   SEED 40192: turns=85, prng=490, winner=p2
  Rust: SEED 40192: turns=85, prng=522, winner=p2
FAIL Seed 40910 (full team):
  JS:   SEED 40910: turns=39, prng=201, winner=p1
  Rust: SEED 40910: turns=51, prng=263, winner=p2
FAIL Seed 45311 (full team):
  JS:   SEED 45311: turns=17, prng=81, winner=p2
  Rust: SEED 45311: turns=14, prng=71, winner=p2
FAIL Seed 48318 (full team):
  JS:   SEED 48318: turns=45, prng=185, winner=p2
  Rust: SEED 48318: turns=47, prng=201, winner=p2
FAIL Seed 60349 (full team):
  JS:   SEED 60349: turns=63, prng=215, winner=p1
  Rust: SEED 60349: turns=64, prng=223, winner=p1
FAIL Seed 60818 (full team):
  JS:   SEED 60818: turns=74, prng=293, winner=p1
  Rust: SEED 60818: turns=70, prng=277, winner=p1
FAIL Seed 64286 (full team):
  JS:   SEED 64286: turns=73, prng=200, winner=p2
  Rust: SEED 64286: turns=81, prng=218, winner=p2
FAIL Seed 67961 (full team):
  JS:   SEED 67961: turns=67, prng=238, winner=p1
  Rust: SEED 67961: turns=65, prng=232, winner=p2
FAIL Seed 71155 (full team):
  JS:   SEED 71155: turns=73, prng=280, winner=p1
  Rust: SEED 71155: turns=76, prng=297, winner=p1
FAIL Seed 71505 (full team):
  JS:   SEED 71505: turns=48, prng=208, winner=p1
  Rust: SEED 71505: turns=49, prng=208, winner=p1
FAIL Seed 72782 (full team):
  JS:   SEED 72782: turns=57, prng=150, winner=p1
  Rust: SEED 72782: turns=62, prng=196, winner=p1
FAIL Seed 74439 (full team):
  JS:   SEED 74439: turns=25, prng=100, winner=p2
  Rust: SEED 74439: turns=23, prng=99, winner=p2
FAIL Seed 78126 (full team):
  JS:   SEED 78126: turns=48, prng=202, winner=p2
  Rust: SEED 78126: turns=50, prng=211, winner=p1
FAIL Seed 79574 (full team):
  JS:   SEED 79574: turns=26, prng=93, winner=p1
  Rust: SEED 79574: turns=23, prng=87, winner=p1
FAIL Seed 80374 (full team):
  JS:   SEED 80374: turns=93, prng=285, winner=none
  Rust: SEED 80374: turns=93, prng=281, winner=none
FAIL Seed 85281 (full team):
  JS:   SEED 85281: turns=78, prng=180, winner=p1
  Rust: SEED 85281: turns=74, prng=170, winner=p1
FAIL Seed 87270 (full team):
  JS:   SEED 87270: turns=45, prng=193, winner=p1
  Rust: SEED 87270: turns=37, prng=152, winner=p2
FAIL Seed 87363 (full team):
  JS:   SEED 87363: turns=27, prng=104, winner=p1
  Rust: SEED 87363: turns=28, prng=108, winner=p1
FAIL Seed 90577 (full team):
  JS:   SEED 90577: turns=41, prng=182, winner=p2
  Rust: SEED 90577: turns=36, prng=277, winner=p2
FAIL Seed 92938 (full team):
  JS:   SEED 92938: turns=18, prng=69, winner=p1
  Rust: SEED 92938: turns=42, prng=145, winner=p1
FAIL Seed 95061 (full team):
  JS:   SEED 95061: turns=62, prng=123, winner=p2
  Rust: SEED 95061: turns=59, prng=105, winner=p2
FAIL Seed 96673 (full team):
  JS:   SEED 96673: turns=69, prng=198, winner=p2
  Rust: SEED 96673: turns=69, prng=204, winner=p2
FAIL Seed 97470 (full team):
  JS:   SEED 97470: turns=85, prng=262, winner=p2
  Rust: SEED 97470: turns=55, prng=198, winner=p2
FAIL Seed 99388 (full team):
  JS:   SEED 99388: turns=59, prng=201, winner=p1
  Rust: SEED 99388: turns=70, prng=240, winner=p1

=======================================
Final Summary
=======================================

Regression tests (1-1000): 1000/1000 passed
Minimized teams: 130/156 passed
Full teams: 128/156 passed

Failed full team seeds: 15759 15974 30232 39361 40192 40910 45311 48318 60349 60818 64286 67961 71155 71505 72782 74439 78126 79574 80374 85281 87270 87363 90577 92938 95061 96673 97470 99388
Minimized seeds pass rate: 83%
Failed minimized seeds: 15759 15974 39361 40910 45311 48318 60349 60818 64286 67961 71155 71505 72782 74439 78126 79574 80374 85281 87270 87363 90577 92938 95061 96673 97470 99388

Updating bug-analysis.txt...
Done. See tests/bug-analysis.txt for patterns in failing seeds.

SUCCESS: No regressions detected.
