=======================================
Part 1: Regression Tests (Seeds 1-1000)
=======================================

Building Rust binaries...
Running unified tests...
Comparing unified results...

FAIL Seed 943:
  JS:   SEED 943: turns=94, prng=159, winner=none
  Rust: SEED 943: turns=95, prng=162, winner=none

Unified tests: 999/1000 passed
REGRESSION DETECTED! Failed seeds: 943

=======================================
Part 2: Minimized Seeds Tests
=======================================

Running 1893 minimized seed tests...
Comparing minimized results...

FAIL Seed 2814:
  JS:   SEED 2814: turns=15, prng=129, winner=p2
  Rust: SEED 2814: turns=15, prng=120, winner=p2
FAIL Seed 5613:
  JS:   SEED 5613: turns=6, prng=64, winner=p2
  Rust: SEED 5613: turns=4, prng=48, winner=p2
FAIL Seed 6527:
  JS:   SEED 6527: turns=36, prng=155, winner=p1
  Rust: SEED 6527: turns=32, prng=137, winner=p1
FAIL Seed 10025:
  JS:   SEED 10025: turns=8, prng=52, winner=p1
  Rust: SEED 10025: turns=9, prng=56, winner=p1
FAIL Seed 10653:
  JS:   SEED 10653: turns=14, prng=65, winner=p1
  Rust: SEED 10653: turns=15, prng=68, winner=p1
FAIL Seed 13693:
  JS:   SEED 13693: turns=4, prng=20, winner=p2
  Rust: SEED 13693: turns=5, prng=20, winner=p2
FAIL Seed 14038:
  JS:   SEED 14038: turns=2, prng=6, winner=p2
  Rust: SEED 14038: turns=2, prng=7, winner=p2
FAIL Seed 14287:
  JS:   SEED 14287: turns=7, prng=17, winner=p1
  Rust: SEED 14287: turns=5, prng=12, winner=p1
FAIL Seed 15480:
  JS:   SEED 15480: turns=7, prng=11, winner=p1
  Rust: SEED 15480: turns=9, prng=9, winner=p1
FAIL Seed 15759:
  JS:   SEED 15759: turns=44, prng=145, winner=p2
  Rust: SEED 15759: turns=45, prng=149, winner=p2
FAIL Seed 15935:
  JS:   SEED 15935: turns=9, prng=68, winner=p2
  Rust: SEED 15935: turns=8, prng=62, winner=p2
FAIL Seed 15974:
  JS:   SEED 15974: turns=20, prng=197, winner=p1
  Rust: SEED 15974: turns=20, prng=169, winner=p1
FAIL Seed 16559:
  JS:   SEED 16559: turns=12, prng=30, winner=p1
  Rust: SEED 16559: turns=6, prng=15, winner=p1
FAIL Seed 17535:
  JS:   SEED 17535: turns=11, prng=30, winner=p2
  Rust: SEED 17535: turns=7, prng=18, winner=p2
FAIL Seed 17585:
  JS:   SEED 17585: turns=13, prng=69, winner=p2
  Rust: SEED 17585: turns=13, prng=66, winner=p2
FAIL Seed 17626:
  JS:   SEED 17626: turns=2, prng=33, winner=p1
  Rust: SEED 17626: turns=2, prng=34, winner=p2
FAIL Seed 18219:
  JS:   SEED 18219: turns=6, prng=23, winner=p1
  Rust: SEED 18219: turns=6, prng=26, winner=p1
FAIL Seed 18657:
  JS:   SEED 18657: turns=5, prng=8, winner=p1
  Rust: SEED 18657: turns=6, prng=0, winner=p1
FAIL Seed 20191:
  JS:   SEED 20191: turns=10, prng=34, winner=p2
  Rust: SEED 20191: turns=24, prng=67, winner=p2
FAIL Seed 20356:
  JS:   SEED 20356: turns=38, prng=159, winner=p1
  Rust: SEED 20356: turns=39, prng=164, winner=p1
FAIL Seed 20875:
  JS:   SEED 20875: turns=34, prng=106, winner=p1
  Rust: SEED 20875: turns=17, prng=51, winner=p1
FAIL Seed 21366:
  JS:   SEED 21366: turns=1, prng=3, winner=p1
  Rust: SEED 21366: turns=4, prng=21, winner=p1
FAIL Seed 21443:
  JS:   SEED 21443: turns=26, prng=89, winner=p1
  Rust: SEED 21443: turns=28, prng=91, winner=p1
FAIL Seed 21977:
  JS:   SEED 21977: turns=4, prng=21, winner=p1
  Rust: SEED 21977: turns=4, prng=24, winner=p1
FAIL Seed 22366:
  JS:   SEED 22366: turns=15, prng=107, winner=p1
  Rust: SEED 22366: turns=15, prng=108, winner=p2
FAIL Seed 22436:
  JS:   SEED 22436: turns=52, prng=12, winner=p2
  Rust: SEED 22436: turns=56, prng=24, winner=p2
FAIL Seed 23363:
  JS:   SEED 23363: turns=25, prng=325, winner=p2
  Rust: SEED 23363: turns=24, prng=360, winner=p2
FAIL Seed 23542:
  JS:   SEED 23542: turns=6, prng=18, winner=p2
  Rust: SEED 23542: turns=3, prng=9, winner=p2
FAIL Seed 24205:
  JS:   SEED 24205: turns=9, prng=15, winner=p1
  Rust: SEED 24205: turns=10, prng=10, winner=p1
FAIL Seed 24207:
  JS:   SEED 24207: turns=81, prng=99, winner=p2
  Rust: SEED 24207: turns=80, prng=101, winner=p2
FAIL Seed 24867:
  JS:   SEED 24867: turns=64, prng=213, winner=p2
  Rust: SEED 24867: turns=62, prng=208, winner=p2
FAIL Seed 25177:
  JS:   SEED 25177: turns=18, prng=99, winner=p1
  Rust: SEED 25177: turns=20, prng=105, winner=p1
FAIL Seed 25574:
  JS:   SEED 25574: turns=11, prng=33, winner=p2
  Rust: SEED 25574: turns=11, prng=43, winner=p2
FAIL Seed 25990:
  JS:   SEED 25990: turns=3, prng=9, winner=p1
  Rust: SEED 25990: turns=4, prng=9, winner=p1
FAIL Seed 26095:
  JS:   SEED 26095: turns=10, prng=30, winner=p1
  Rust: SEED 26095: turns=5, prng=15, winner=p1
FAIL Seed 27586:
  JS:   SEED 27586: turns=69, prng=55, winner=p1
  Rust: SEED 27586: turns=70, prng=60, winner=p1
FAIL Seed 27999:
  JS:   SEED 27999: turns=4, prng=57, winner=p2
  Rust: SEED 27999: turns=4, prng=59, winner=p2
FAIL Seed 28200:
  JS:   SEED 28200: turns=5, prng=15, winner=p1
  Rust: SEED 28200: turns=7, prng=21, winner=p1
FAIL Seed 28590:
  JS:   SEED 28590: turns=2, prng=11, winner=p2
  Rust: SEED 28590: turns=2, prng=8, winner=p2
FAIL Seed 29161:
  JS:   SEED 29161: turns=25, prng=78, winner=p2
  Rust: SEED 29161: turns=25, prng=80, winner=p1
FAIL Seed 29611:
  JS:   SEED 29611: turns=7, prng=26, winner=p2
  Rust: SEED 29611: turns=8, prng=30, winner=p2
FAIL Seed 30020:
  JS:   SEED 30020: turns=33, prng=117, winner=p2
  Rust: SEED 30020: turns=33, prng=98, winner=p1
FAIL Seed 30232:
  JS:   SEED 30232: turns=31, prng=152, winner=p2
  Rust: SEED 30232: turns=32, prng=155, winner=p2
FAIL Seed 30300:
  JS:   SEED 30300: turns=5, prng=17, winner=p1
  Rust: SEED 30300: turns=5, prng=19, winner=p1
FAIL Seed 30446:
  JS:   SEED 30446: turns=45, prng=133, winner=p1
  Rust: SEED 30446: turns=50, prng=127, winner=p2
FAIL Seed 30530:
  JS:   SEED 30530: turns=38, prng=123, winner=p1
  Rust: SEED 30530: turns=39, prng=121, winner=p2
FAIL Seed 30834:
  JS:   SEED 30834: turns=27, prng=133, winner=p1
  Rust: SEED 30834: turns=26, prng=130, winner=p1
FAIL Seed 30853:
  JS:   SEED 30853: turns=30, prng=113, winner=p1
  Rust: SEED 30853: turns=32, prng=117, winner=p1
FAIL Seed 32517:
  JS:   SEED 32517: turns=6, prng=42, winner=p2
  Rust: SEED 32517: turns=5, prng=30, winner=p2
FAIL Seed 32939:
  JS:   SEED 32939: turns=13, prng=65, winner=p1
  Rust: SEED 32939: turns=13, prng=64, winner=p1
FAIL Seed 33325:
  JS:   SEED 33325: turns=8, prng=11, winner=p1
  Rust: SEED 33325: turns=9, prng=9, winner=p1
FAIL Seed 33826:
  JS:   SEED 33826: turns=4, prng=25, winner=p2
  Rust: SEED 33826: turns=5, prng=32, winner=p2
FAIL Seed 33847:
  JS:   SEED 33847: turns=15, prng=161, winner=p1
  Rust: SEED 33847: turns=15, prng=160, winner=p1
FAIL Seed 33996:
  JS:   SEED 33996: turns=8, prng=37, winner=p1
  Rust: SEED 33996: turns=7, prng=23, winner=p1
FAIL Seed 34206:
  JS:   SEED 34206: turns=13, prng=43, winner=p1
  Rust: SEED 34206: turns=13, prng=40, winner=p1
FAIL Seed 34248:
  JS:   SEED 34248: turns=37, prng=130, winner=p1
  Rust: SEED 34248: turns=46, prng=152, winner=p1
FAIL Seed 34471:
  JS:   SEED 34471: turns=18, prng=58, winner=p1
  Rust: SEED 34471: turns=19, prng=108, winner=p1
FAIL Seed 34858:
  JS:   SEED 34858: turns=28, prng=36, winner=p2
  Rust: SEED 34858: turns=33, prng=52, winner=p2
FAIL Seed 35203:
  JS:   SEED 35203: turns=6, prng=104, winner=p2
  Rust: SEED 35203: turns=6, prng=105, winner=p2
FAIL Seed 35406:
  JS:   SEED 35406: turns=7, prng=45, winner=p2
  Rust: SEED 35406: turns=9, prng=49, winner=p1
FAIL Seed 35489:
  JS:   SEED 35489: turns=4, prng=19, winner=p2
  Rust: SEED 35489: turns=4, prng=16, winner=p2
FAIL Seed 35620:
  JS:   SEED 35620: turns=9, prng=27, winner=p2
  Rust: SEED 35620: turns=9, prng=35, winner=p2
FAIL Seed 35671:
  JS:   SEED 35671: turns=6, prng=18, winner=p2
  Rust: SEED 35671: turns=5, prng=15, winner=p2
FAIL Seed 35876:
  JS:   SEED 35876: turns=40, prng=33, winner=p2
  Rust: SEED 35876: turns=39, prng=31, winner=p1
FAIL Seed 36529:
  JS:   SEED 36529: turns=12, prng=29, winner=p1
  Rust: SEED 36529: turns=7, prng=17, winner=p1
FAIL Seed 36737:
  JS:   SEED 36737: turns=12, prng=50, winner=p2
  Rust: SEED 36737: turns=15, prng=76, winner=p2
FAIL Seed 37514:
  JS:   SEED 37514: turns=35, prng=168, winner=p1
  Rust: SEED 37514: turns=36, prng=172, winner=p1
FAIL Seed 37661:
  JS:   SEED 37661: turns=6, prng=15, winner=p1
  Rust: SEED 37661: turns=8, prng=15, winner=p1
FAIL Seed 38902:
  JS:   SEED 38902: turns=20, prng=117, winner=p1
  Rust: SEED 38902: turns=21, prng=135, winner=p1
FAIL Seed 39290:
  JS:   SEED 39290: turns=39, prng=61, winner=p2
  Rust: SEED 39290: turns=39, prng=106, winner=p2
FAIL Seed 39361:
  JS:   SEED 39361: turns=11, prng=56, winner=p1
  Rust: SEED 39361: turns=25, prng=98, winner=p2
FAIL Seed 39435:
  JS:   SEED 39435: turns=23, prng=141, winner=p2
  Rust: SEED 39435: turns=23, prng=145, winner=p2
FAIL Seed 39892:
  JS:   SEED 39892: turns=6, prng=24, winner=p1
  Rust: SEED 39892: turns=17, prng=42, winner=p2
FAIL Seed 40056:
  JS:   SEED 40056: turns=19, prng=79, winner=p1
  Rust: SEED 40056: turns=17, prng=51, winner=p2
FAIL Seed 40097:
  JS:   SEED 40097: turns=17, prng=66, winner=p2
  Rust: SEED 40097: turns=11, prng=43, winner=p2
FAIL Seed 40678:
  JS:   SEED 40678: turns=49, prng=174, winner=p2
  Rust: SEED 40678: turns=50, prng=179, winner=p2
FAIL Seed 40910:
  JS:   SEED 40910: turns=2, prng=16, winner=p1
  Rust: SEED 40910: turns=3, prng=24, winner=p1
FAIL Seed 41340:
  JS:   SEED 41340: turns=29, prng=187, winner=p1
  Rust: SEED 41340: turns=30, prng=192, winner=p1
FAIL Seed 41457:
  JS:   SEED 41457: turns=19, prng=79, winner=p2
  Rust: SEED 41457: turns=17, prng=53, winner=p1
FAIL Seed 42063:
  JS:   SEED 42063: turns=23, prng=88, winner=p2
  Rust: SEED 42063: turns=22, prng=84, winner=p1
FAIL Seed 42282:
  JS:   SEED 42282: turns=11, prng=154, winner=p1
  Rust: SEED 42282: turns=10, prng=140, winner=p1
FAIL Seed 42590:
  JS:   SEED 42590: turns=4, prng=21, winner=p1
  Rust: SEED 42590: turns=2, prng=12, winner=p2
FAIL Seed 43153:
  JS:   SEED 43153: turns=40, prng=96, winner=p1
  Rust: SEED 43153: turns=39, prng=87, winner=p1
FAIL Seed 43394:
  JS:   SEED 43394: turns=27, prng=145, winner=p2
  Rust: SEED 43394: turns=26, prng=137, winner=p2
FAIL Seed 43581:
  JS:   SEED 43581: turns=19, prng=263, winner=p1
  Rust: SEED 43581: turns=19, prng=289, winner=p1
FAIL Seed 43605:
  JS:   SEED 43605: turns=7, prng=29, winner=p2
  Rust: SEED 43605: turns=7, prng=33, winner=p2
FAIL Seed 43782:
  JS:   SEED 43782: turns=12, prng=57, winner=p2
  Rust: SEED 43782: turns=12, prng=60, winner=p2
FAIL Seed 43873:
  JS:   SEED 43873: turns=5, prng=35, winner=p2
  Rust: SEED 43873: turns=6, prng=42, winner=p2
FAIL Seed 43878:
  JS:   SEED 43878: turns=3, prng=15, winner=p1
  Rust: SEED 43878: turns=3, prng=13, winner=p1
FAIL Seed 43980:
  JS:   SEED 43980: turns=29, prng=92, winner=p2
  Rust: SEED 43980: turns=29, prng=72, winner=p2
FAIL Seed 44135:
  JS:   SEED 44135: turns=20, prng=81, winner=p1
  Rust: SEED 44135: turns=20, prng=81, winner=p2
FAIL Seed 45311:
  JS:   SEED 45311: turns=3, prng=18, winner=p2
  Rust: SEED 45311: turns=2, prng=12, winner=p2
FAIL Seed 45726:
  JS:   SEED 45726: turns=7, prng=39, winner=p2
  Rust: SEED 45726: turns=5, prng=27, winner=p1
FAIL Seed 46244:
  JS:   SEED 46244: turns=64, prng=98, winner=p2
  Rust: SEED 46244: turns=64, prng=100, winner=p2
FAIL Seed 46733:
  JS:   SEED 46733: turns=9, prng=18, winner=p1
  Rust: SEED 46733: turns=11, prng=18, winner=p1
FAIL Seed 47054:
  JS:   SEED 47054: turns=5, prng=15, winner=p1
  Rust: SEED 47054: turns=3, prng=9, winner=p1
FAIL Seed 48145:
  JS:   SEED 48145: turns=12, prng=77, winner=p1
  Rust: SEED 48145: turns=8, prng=58, winner=p2
FAIL Seed 48178:
  JS:   SEED 48178: turns=18, prng=58, winner=p1
  Rust: SEED 48178: turns=17, prng=53, winner=p1
FAIL Seed 48318:
  JS:   SEED 48318: turns=2, prng=7, winner=p2
  Rust: SEED 48318: turns=10, prng=30, winner=p1
FAIL Seed 48575:
  JS:   SEED 48575: turns=6, prng=33, winner=p2
  Rust: SEED 48575: turns=4, prng=24, winner=p1
FAIL Seed 48869:
  JS:   SEED 48869: turns=3, prng=15, winner=p2
  Rust: SEED 48869: turns=4, prng=25, winner=p2
FAIL Seed 49003:
  JS:   SEED 49003: turns=10, prng=24, winner=p2
  Rust: SEED 49003: turns=12, prng=28, winner=p2
FAIL Seed 49229:
  JS:   SEED 49229: turns=12, prng=171, winner=p2
  Rust: SEED 49229: turns=12, prng=165, winner=p2
FAIL Seed 49341:
  JS:   SEED 49341: turns=16, prng=210, winner=p1
  Rust: SEED 49341: turns=16, prng=236, winner=p1
FAIL Seed 51252:
  JS:   SEED 51252: turns=16, prng=52, winner=p2
  Rust: SEED 51252: turns=14, prng=52, winner=p2
FAIL Seed 52074:
  JS:   SEED 52074: turns=7, prng=28, winner=p2
  Rust: SEED 52074: turns=7, prng=42, winner=p2
FAIL Seed 52111:
  JS:   SEED 52111: turns=7, prng=36, winner=p1
  Rust: SEED 52111: turns=5, prng=30, winner=p1
FAIL Seed 52401:
  JS:   SEED 52401: turns=4, prng=12, winner=p1
  Rust: SEED 52401: turns=4, prng=16, winner=p1
FAIL Seed 52895:
  JS:   SEED 52895: turns=12, prng=24, winner=p2
  Rust: SEED 52895: turns=12, prng=25, winner=p2
FAIL Seed 53148:
  JS:   SEED 53148: turns=5, prng=23, winner=p1
  Rust: SEED 53148: turns=6, prng=30, winner=p1
FAIL Seed 53209:
  JS:   SEED 53209: turns=49, prng=139, winner=p1
  Rust: SEED 53209: turns=47, prng=131, winner=p1
FAIL Seed 53360:
  JS:   SEED 53360: turns=9, prng=67, winner=p2
  Rust: SEED 53360: turns=9, prng=68, winner=p2
FAIL Seed 53499:
  JS:   SEED 53499: turns=55, prng=222, winner=p1
  Rust: SEED 53499: turns=59, prng=231, winner=p1
FAIL Seed 53537:
  JS:   SEED 53537: turns=23, prng=105, winner=p2
  Rust: SEED 53537: turns=20, prng=87, winner=p2
FAIL Seed 53747:
  JS:   SEED 53747: turns=27, prng=133, winner=p1
  Rust: SEED 53747: turns=28, prng=139, winner=p1
FAIL Seed 53815:
  JS:   SEED 53815: turns=20, prng=31, winner=p1
  Rust: SEED 53815: turns=20, prng=41, winner=p1
FAIL Seed 53949:
  JS:   SEED 53949: turns=3, prng=9, winner=p2
  Rust: SEED 53949: turns=7, prng=28, winner=p2
FAIL Seed 54222:
  JS:   SEED 54222: turns=44, prng=526, winner=p2
  Rust: SEED 54222: turns=44, prng=552, winner=p2
FAIL Seed 55113:
  JS:   SEED 55113: turns=5, prng=15, winner=p1
  Rust: SEED 55113: turns=11, prng=27, winner=p1
FAIL Seed 55162:
  JS:   SEED 55162: turns=43, prng=52, winner=p2
  Rust: SEED 55162: turns=33, prng=33, winner=p2
FAIL Seed 55508:
  JS:   SEED 55508: turns=14, prng=55, winner=p2
  Rust: SEED 55508: turns=7, prng=21, winner=p2
FAIL Seed 55954:
  JS:   SEED 55954: turns=23, prng=120, winner=p1
  Rust: SEED 55954: turns=18, prng=87, winner=p1
FAIL Seed 56089:
  JS:   SEED 56089: turns=17, prng=53, winner=p1
  Rust: SEED 56089: turns=18, prng=55, winner=p1
FAIL Seed 56264:
  JS:   SEED 56264: turns=2, prng=9, winner=p2
  Rust: SEED 56264: turns=3, prng=15, winner=p2
FAIL Seed 56825:
  JS:   SEED 56825: turns=40, prng=48, winner=p2
  Rust: SEED 56825: turns=41, prng=51, winner=p2
FAIL Seed 57522:
  JS:   SEED 57522: turns=15, prng=89, winner=p2
  Rust: SEED 57522: turns=37, prng=155, winner=p1
FAIL Seed 58474:
  JS:   SEED 58474: turns=14, prng=59, winner=p2
  Rust: SEED 58474: turns=25, prng=69, winner=p2
FAIL Seed 59120:
  JS:   SEED 59120: turns=25, prng=98, winner=p2
  Rust: SEED 59120: turns=24, prng=94, winner=p2
FAIL Seed 59646:
  JS:   SEED 59646: turns=17, prng=0, winner=p1
  Rust: SEED 59646: turns=21, prng=0, winner=p2
FAIL Seed 60349:
  JS:   SEED 60349: turns=9, prng=51, winner=p2
  Rust: SEED 60349: turns=9, prng=60, winner=p2
FAIL Seed 60818:
  JS:   SEED 60818: turns=70, prng=295, winner=p2
  Rust: SEED 60818: turns=58, prng=247, winner=p2
FAIL Seed 60885:
  JS:   SEED 60885: turns=32, prng=106, winner=p1
  Rust: SEED 60885: turns=32, prng=109, winner=p1
FAIL Seed 61343:
  JS:   SEED 61343: turns=8, prng=270, winner=p1
  Rust: SEED 61343: turns=8, prng=170, winner=p1
FAIL Seed 61431:
  JS:   SEED 61431: turns=17, prng=45, winner=p2
  Rust: SEED 61431: turns=17, prng=47, winner=p2
FAIL Seed 61530:
  JS:   SEED 61530: turns=9, prng=110, winner=p1
  Rust: SEED 61530: turns=10, prng=137, winner=p1
FAIL Seed 62499:
  JS:   SEED 62499: turns=5, prng=30, winner=p1
  Rust: SEED 62499: turns=7, prng=39, winner=p2
FAIL Seed 62883:
  JS:   SEED 62883: turns=7, prng=37, winner=p1
  Rust: SEED 62883: turns=7, prng=46, winner=p1
FAIL Seed 63094:
  JS:   SEED 63094: turns=39, prng=140, winner=p2
  Rust: SEED 63094: turns=39, prng=141, winner=p2
FAIL Seed 63529:
  JS:   SEED 63529: turns=18, prng=52, winner=p1
  Rust: SEED 63529: turns=18, prng=53, winner=p1
FAIL Seed 64022:
  JS:   SEED 64022: turns=24, prng=154, winner=p1
  Rust: SEED 64022: turns=26, prng=165, winner=p1
FAIL Seed 64149:
  JS:   SEED 64149: turns=5, prng=26, winner=p1
  Rust: SEED 64149: turns=5, prng=24, winner=p1
FAIL Seed 64566:
  JS:   SEED 64566: turns=6, prng=189, winner=p1
  Rust: SEED 64566: turns=6, prng=126, winner=p1
FAIL Seed 64605:
  JS:   SEED 64605: turns=5, prng=32, winner=p2
  Rust: SEED 64605: turns=3, prng=18, winner=p2
FAIL Seed 64920:
  JS:   SEED 64920: turns=8, prng=116, winner=p1
  Rust: SEED 64920: turns=9, prng=132, winner=p1
FAIL Seed 65490:
  JS:   SEED 65490: turns=33, prng=125, winner=p2
  Rust: SEED 65490: turns=31, prng=114, winner=p2
FAIL Seed 65503:
  JS:   SEED 65503: turns=18, prng=47, winner=p1
  Rust: SEED 65503: turns=19, prng=52, winner=p1

=======================================
Final Summary
=======================================

Regression tests (1-1000): 999/1000 passed
Minimized seeds: 1747/1893 passed

REGRESSION DETECTED in unified tests!
Failed seeds: 943
Minimized seeds pass rate: 92%
Failed minimized seeds: 2814 5613 6527 10025 10653 13693 14038 14287 15480 15759 15935 15974 16559 17535 17585 17626 18219 18657 20191 20356 20875 21366 21443 21977 22366 22436 23363 23542 24205 24207 24867 25177 25574 25990 26095 27586 27999 28200 28590 29161 29611 30020 30232 30300 30446 30530 30834 30853 32517 32939 33325 33826 33847 33996 34206 34248 34471 34858 35203 35406 35489 35620 35671 35876 36529 36737 37514 37661 38902 39290 39361 39435 39892 40056 40097 40678 40910 41340 41457 42063 42282 42590 43153 43394 43581 43605 43782 43873 43878 43980 44135 45311 45726 46244 46733 47054 48145 48178 48318 48575 48869 49003 49229 49341 51252 52074 52111 52401 52895 53148 53209 53360 53499 53537 53747 53815 53949 54222 55113 55162 55508 55954 56089 56264 56825 57522 58474 59120 59646 60349 60818 60885 61343 61431 61530 62499 62883 63094 63529 64022 64149 64566 64605 64920 65490 65503

Updating bug-analysis.txt...
Done. See tests/bug-analysis.txt for patterns in failing seeds.

FAILURE: Regressions or failures detected.
