=======================================
Part 1: Regression Tests (Seeds 1-1000)
=======================================

Building Rust binaries...
Running unified tests...
Comparing unified results...

FAIL Seed 943:
  JS:   SEED 943: turns=94, prng=159, winner=none
  Rust: SEED 943: turns=95, prng=162, winner=none

Unified tests: 999/1000 passed
REGRESSION DETECTED! Failed seeds: 943

=======================================
Part 2: Minimized Seeds Tests
=======================================

Running 1893 minimized seed tests...
Comparing minimized results...

FAIL Seed 6527:
  JS:   SEED 6527: turns=36, prng=155, winner=p1
  Rust: SEED 6527: turns=32, prng=137, winner=p1
FAIL Seed 10025:
  JS:   SEED 10025: turns=8, prng=52, winner=p1
  Rust: SEED 10025: turns=9, prng=56, winner=p1
FAIL Seed 10653:
  JS:   SEED 10653: turns=14, prng=65, winner=p1
  Rust: SEED 10653: turns=15, prng=68, winner=p1
FAIL Seed 14287:
  JS:   SEED 14287: turns=7, prng=17, winner=p1
  Rust: SEED 14287: turns=5, prng=12, winner=p1
FAIL Seed 15759:
  JS:   SEED 15759: turns=44, prng=145, winner=p2
  Rust: SEED 15759: turns=45, prng=149, winner=p2
FAIL Seed 15974:
  JS:   SEED 15974: turns=20, prng=197, winner=p1
  Rust: SEED 15974: turns=20, prng=169, winner=p1
FAIL Seed 17535:
  JS:   SEED 17535: turns=11, prng=30, winner=p2
  Rust: SEED 17535: turns=7, prng=18, winner=p2
FAIL Seed 18219:
  JS:   SEED 18219: turns=6, prng=23, winner=p1
  Rust: SEED 18219: turns=6, prng=26, winner=p1
FAIL Seed 20356:
  JS:   SEED 20356: turns=38, prng=159, winner=p1
  Rust: SEED 20356: turns=39, prng=164, winner=p1
FAIL Seed 20875:
  JS:   SEED 20875: turns=34, prng=106, winner=p1
  Rust: SEED 20875: turns=17, prng=51, winner=p1
FAIL Seed 21366:
  JS:   SEED 21366: turns=1, prng=3, winner=p1
  Rust: SEED 21366: turns=4, prng=21, winner=p1
FAIL Seed 22436:
  JS:   SEED 22436: turns=52, prng=12, winner=p2
  Rust: SEED 22436: turns=56, prng=24, winner=p2
FAIL Seed 23363:
  JS:   SEED 23363: turns=25, prng=325, winner=p2
  Rust: SEED 23363: turns=24, prng=360, winner=p2
FAIL Seed 25177:
  JS:   SEED 25177: turns=18, prng=99, winner=p1
  Rust: SEED 25177: turns=20, prng=105, winner=p1
FAIL Seed 25574:
  JS:   SEED 25574: turns=11, prng=33, winner=p2
  Rust: SEED 25574: turns=11, prng=43, winner=p2
FAIL Seed 26095:
  JS:   SEED 26095: turns=10, prng=30, winner=p1
  Rust: SEED 26095: turns=5, prng=15, winner=p1
FAIL Seed 28200:
  JS:   SEED 28200: turns=5, prng=15, winner=p1
  Rust: SEED 28200: turns=7, prng=21, winner=p1
FAIL Seed 29161:
  JS:   SEED 29161: turns=25, prng=78, winner=p2
  Rust: SEED 29161: turns=25, prng=80, winner=p1
FAIL Seed 29611:
  JS:   SEED 29611: turns=7, prng=26, winner=p2
  Rust: SEED 29611: turns=8, prng=30, winner=p2
FAIL Seed 30232:
  JS:   SEED 30232: turns=31, prng=152, winner=p2
  Rust: SEED 30232: turns=32, prng=155, winner=p2
FAIL Seed 32939:
  JS:   SEED 32939: turns=13, prng=65, winner=p1
  Rust: SEED 32939: turns=13, prng=64, winner=p1
FAIL Seed 34858:
  JS:   SEED 34858: turns=28, prng=36, winner=p2
  Rust: SEED 34858: turns=33, prng=52, winner=p2
FAIL Seed 35203:
  JS:   SEED 35203: turns=6, prng=104, winner=p2
  Rust: SEED 35203: turns=6, prng=105, winner=p2
FAIL Seed 35620:
  JS:   SEED 35620: turns=9, prng=27, winner=p2
  Rust: SEED 35620: turns=9, prng=35, winner=p2
FAIL Seed 35671:
  JS:   SEED 35671: turns=6, prng=18, winner=p2
  Rust: SEED 35671: turns=5, prng=15, winner=p2
FAIL Seed 35876:
  JS:   SEED 35876: turns=40, prng=33, winner=p2
  Rust: SEED 35876: turns=39, prng=31, winner=p1
FAIL Seed 36529:
  JS:   SEED 36529: turns=12, prng=29, winner=p1
  Rust: SEED 36529: turns=7, prng=17, winner=p1
FAIL Seed 37514:
  JS:   SEED 37514: turns=35, prng=168, winner=p1
  Rust: SEED 37514: turns=36, prng=172, winner=p1
FAIL Seed 38902:
  JS:   SEED 38902: turns=20, prng=117, winner=p1
  Rust: SEED 38902: turns=21, prng=135, winner=p1
FAIL Seed 39361:
  JS:   SEED 39361: turns=11, prng=56, winner=p1
  Rust: SEED 39361: turns=25, prng=98, winner=p2
FAIL Seed 39892:
  JS:   SEED 39892: turns=6, prng=24, winner=p1
  Rust: SEED 39892: turns=17, prng=42, winner=p2
FAIL Seed 40097:
  JS:   SEED 40097: turns=17, prng=66, winner=p2
  Rust: SEED 40097: turns=11, prng=43, winner=p2
FAIL Seed 40910:
  JS:   SEED 40910: turns=2, prng=16, winner=p1
  Rust: SEED 40910: turns=3, prng=24, winner=p1
FAIL Seed 42063:
  JS:   SEED 42063: turns=23, prng=88, winner=p2
  Rust: SEED 42063: turns=22, prng=84, winner=p1
FAIL Seed 42590:
  JS:   SEED 42590: turns=4, prng=21, winner=p1
  Rust: SEED 42590: turns=2, prng=12, winner=p2
FAIL Seed 43153:
  JS:   SEED 43153: turns=40, prng=96, winner=p1
  Rust: SEED 43153: turns=39, prng=87, winner=p1
FAIL Seed 43581:
  JS:   SEED 43581: turns=19, prng=263, winner=p1
  Rust: SEED 43581: turns=19, prng=289, winner=p1
FAIL Seed 43782:
  JS:   SEED 43782: turns=12, prng=57, winner=p2
  Rust: SEED 43782: turns=12, prng=60, winner=p2
FAIL Seed 44135:
  JS:   SEED 44135: turns=20, prng=81, winner=p1
  Rust: SEED 44135: turns=20, prng=81, winner=p2
FAIL Seed 45311:
  JS:   SEED 45311: turns=3, prng=18, winner=p2
  Rust: SEED 45311: turns=2, prng=12, winner=p2
FAIL Seed 48178:
  JS:   SEED 48178: turns=18, prng=58, winner=p1
  Rust: SEED 48178: turns=17, prng=53, winner=p1
FAIL Seed 48318:
  JS:   SEED 48318: turns=2, prng=7, winner=p2
  Rust: SEED 48318: turns=10, prng=30, winner=p1
FAIL Seed 48869:
  JS:   SEED 48869: turns=3, prng=15, winner=p2
  Rust: SEED 48869: turns=4, prng=25, winner=p2
FAIL Seed 49341:
  JS:   SEED 49341: turns=16, prng=210, winner=p1
  Rust: SEED 49341: turns=16, prng=236, winner=p1
FAIL Seed 52111:
  JS:   SEED 52111: turns=7, prng=36, winner=p1
  Rust: SEED 52111: turns=5, prng=30, winner=p1
FAIL Seed 52895:
  JS:   SEED 52895: turns=12, prng=24, winner=p2
  Rust: SEED 52895: turns=12, prng=25, winner=p2
FAIL Seed 53148:
  JS:   SEED 53148: turns=5, prng=23, winner=p1
  Rust: SEED 53148: turns=6, prng=30, winner=p1
FAIL Seed 53209:
  JS:   SEED 53209: turns=49, prng=139, winner=p1
  Rust: SEED 53209: turns=47, prng=131, winner=p1
FAIL Seed 53747:
  JS:   SEED 53747: turns=27, prng=133, winner=p1
  Rust: SEED 53747: turns=28, prng=139, winner=p1
FAIL Seed 54222:
  JS:   SEED 54222: turns=44, prng=526, winner=p2
  Rust: SEED 54222: turns=44, prng=552, winner=p2
FAIL Seed 55162:
  JS:   SEED 55162: turns=43, prng=52, winner=p2
  Rust: SEED 55162: turns=33, prng=33, winner=p2
FAIL Seed 55954:
  JS:   SEED 55954: turns=23, prng=120, winner=p1
  Rust: SEED 55954: turns=18, prng=87, winner=p1
FAIL Seed 56089:
  JS:   SEED 56089: turns=17, prng=53, winner=p1
  Rust: SEED 56089: turns=18, prng=55, winner=p1
FAIL Seed 56264:
  JS:   SEED 56264: turns=2, prng=9, winner=p2
  Rust: SEED 56264: turns=3, prng=15, winner=p2
FAIL Seed 56825:
  JS:   SEED 56825: turns=40, prng=48, winner=p2
  Rust: SEED 56825: turns=41, prng=51, winner=p2
FAIL Seed 57522:
  JS:   SEED 57522: turns=15, prng=89, winner=p2
  Rust: SEED 57522: turns=37, prng=155, winner=p1
FAIL Seed 59646:
  JS:   SEED 59646: turns=17, prng=0, winner=p1
  Rust: SEED 59646: turns=21, prng=0, winner=p2
FAIL Seed 60349:
  JS:   SEED 60349: turns=9, prng=51, winner=p2
  Rust: SEED 60349: turns=9, prng=60, winner=p2
FAIL Seed 60818:
  JS:   SEED 60818: turns=70, prng=295, winner=p2
  Rust: SEED 60818: turns=58, prng=247, winner=p2
FAIL Seed 60885:
  JS:   SEED 60885: turns=32, prng=106, winner=p1
  Rust: SEED 60885: turns=32, prng=109, winner=p1
FAIL Seed 61343:
  JS:   SEED 61343: turns=8, prng=270, winner=p1
  Rust: SEED 61343: turns=8, prng=170, winner=p1
FAIL Seed 61431:
  JS:   SEED 61431: turns=17, prng=45, winner=p2
  Rust: SEED 61431: turns=17, prng=47, winner=p2
FAIL Seed 62499:
  JS:   SEED 62499: turns=5, prng=30, winner=p1
  Rust: SEED 62499: turns=7, prng=39, winner=p2
FAIL Seed 63529:
  JS:   SEED 63529: turns=18, prng=52, winner=p1
  Rust: SEED 63529: turns=18, prng=53, winner=p1
FAIL Seed 64566:
  JS:   SEED 64566: turns=6, prng=189, winner=p1
  Rust: SEED 64566: turns=6, prng=126, winner=p1
FAIL Seed 64920:
  JS:   SEED 64920: turns=8, prng=116, winner=p1
  Rust: SEED 64920: turns=9, prng=132, winner=p1
FAIL Seed 65490:
  JS:   SEED 65490: turns=33, prng=125, winner=p2
  Rust: SEED 65490: turns=31, prng=114, winner=p2
FAIL Seed 65503:
  JS:   SEED 65503: turns=18, prng=47, winner=p1
  Rust: SEED 65503: turns=19, prng=52, winner=p1

=======================================
Final Summary
=======================================

Regression tests (1-1000): 999/1000 passed
Minimized seeds: 1825/1893 passed

REGRESSION DETECTED in unified tests!
Failed seeds: 943
Minimized seeds pass rate: 96%
Failed minimized seeds: 6527 10025 10653 14287 15759 15974 17535 18219 20356 20875 21366 22436 23363 25177 25574 26095 28200 29161 29611 30232 32939 34858 35203 35620 35671 35876 36529 37514 38902 39361 39892 40097 40910 42063 42590 43153 43581 43782 44135 45311 48178 48318 48869 49341 52111 52895 53148 53209 53747 54222 55162 55954 56089 56264 56825 57522 59646 60349 60818 60885 61343 61431 62499 63529 64566 64920 65490 65503

Updating bug-analysis.txt...
Done. See tests/bug-analysis.txt for patterns in failing seeds.

FAILURE: Regressions or failures detected.
